{
  "schemaVersion": "openadam.agent-shell-adapter.v0.1",
  "id": "openadam.github-copilot-cli-hooks",
  "version": "0.1.0",
  "provider": "github-copilot-cli",
  "transport": "official-hooks",
  "collection": { "passiveMetadata": true, "explicitAnalysisPack": false },
  "signals": {
    "modelSteps": "unavailable",
    "toolOffers": "unavailable",
    "toolCalls": "partial",
    "toolResults": "partial",
    "usage": "unavailable",
    "turnEnds": "partial",
    "selfReportedRationalePresence": "unavailable"
  },
  "content": { "passiveStorage": "metadata-only", "explicitPack": "metadata-only" },
  "runtime": { "platforms": ["darwin", "win32", "linux"], "sourceFormats": ["openadam.agent-shell-trace-bridge.v0.1", "github-copilot-cli-hooks"] }
}
